{
  "$schema": "http://json-schema.org/draft-07/schema#",
  "additionalProperties": false,
  "properties": {
    "contractVersion": {
      "const": 1,
      "type": "number"
    },
    "correlation": {
      "additionalProperties": false,
      "properties": {
        "requestId": {
          "maxLength": 128,
          "minLength": 1,
          "pattern": "^[A-Za-z0-9][A-Za-z0-9_-]*$",
          "type": "string"
        },
        "sessionId": {
          "maxLength": 128,
          "minLength": 1,
          "pattern": "^[A-Za-z0-9][A-Za-z0-9_-]*$",
          "type": "string"
        },
        "taskId": {
          "maxLength": 128,
          "minLength": 1,
          "pattern": "^[A-Za-z0-9][A-Za-z0-9_-]*$",
          "type": "string"
        },
        "userId": {
          "maxLength": 128,
          "minLength": 1,
          "pattern": "^[A-Za-z0-9][A-Za-z0-9_-]*$",
          "type": "string"
        }
      },
      "required": [
        "requestId",
        "userId"
      ],
      "type": "object"
    },
    "evidence": {
      "items": {
        "additionalProperties": false,
        "properties": {
          "retrievedAt": {
            "format": "date-time",
            "pattern": "^(?:(?:\\d\\d[2468][048]|\\d\\d[13579][26]|\\d\\d0[48]|[02468][048]00|[13579][26]00)-02-29|\\d{4}-(?:(?:0[13578]|1[02])-(?:0[1-9]|[12]\\d|3[01])|(?:0[469]|11)-(?:0[1-9]|[12]\\d|30)|(?:02)-(?:0[1-9]|1\\d|2[0-8])))T(?:(?:[01]\\d|2[0-3]):[0-5]\\d(?::[0-5]\\d(?:\\.\\d+)?)?(?:Z|([+-](?:[01]\\d|2[0-3]):[0-5]\\d)))$",
            "type": "string"
          },
          "snippet": {
            "maxLength": 2000,
            "type": "string"
          },
          "sourceUrl": {
            "maxLength": 2048,
            "type": "string"
          },
          "title": {
            "maxLength": 300,
            "minLength": 1,
            "type": "string"
          }
        },
        "required": [
          "sourceUrl",
          "title",
          "snippet",
          "retrievedAt"
        ],
        "type": "object"
      },
      "maxItems": 20,
      "type": "array"
    },
    "payload": {
      "additionalProperties": false,
      "properties": {
        "accessibility": {
          "items": {
            "additionalProperties": false,
            "properties": {
              "correlated": {
                "type": "boolean"
              },
              "description": {
                "anyOf": [
                  {
                    "maxLength": 1000,
                    "type": "string"
                  },
                  {
                    "type": "null"
                  }
                ]
              },
              "domTag": {
                "anyOf": [
                  {
                    "maxLength": 60,
                    "type": "string"
                  },
                  {
                    "type": "null"
                  }
                ]
              },
              "name": {
                "anyOf": [
                  {
                    "maxLength": 500,
                    "type": "string"
                  },
                  {
                    "type": "null"
                  }
                ]
              },
              "nodeId": {
                "maxLength": 64,
                "minLength": 1,
                "type": "string"
              },
              "parentId": {
                "anyOf": [
                  {
                    "maxLength": 64,
                    "type": "string"
                  },
                  {
                    "type": "null"
                  }
                ]
              },
              "role": {
                "maxLength": 60,
                "minLength": 1,
                "type": "string"
              },
              "states": {
                "additionalProperties": {
                  "anyOf": [
                    {
                      "type": "boolean"
                    },
                    {
                      "maxLength": 60,
                      "type": "string"
                    }
                  ]
                },
                "propertyNames": {
                  "maxLength": 40,
                  "type": "string"
                },
                "type": "object"
              },
              "value": {
                "anyOf": [
                  {
                    "maxLength": 300,
                    "type": "string"
                  },
                  {
                    "type": "null"
                  }
                ]
              }
            },
            "required": [
              "nodeId",
              "parentId",
              "role",
              "name",
              "description",
              "value",
              "states",
              "domTag",
              "correlated"
            ],
            "type": "object"
          },
          "maxItems": 1500,
          "type": "array"
        },
        "chunks": {
          "items": {
            "additionalProperties": false,
            "properties": {
              "chunkId": {
                "maxLength": 64,
                "minLength": 1,
                "type": "string"
              },
              "endOffset": {
                "maximum": 9007199254740991,
                "minimum": 0,
                "type": "integer"
              },
              "startOffset": {
                "maximum": 9007199254740991,
                "minimum": 0,
                "type": "integer"
              },
              "text": {
                "maxLength": 8000,
                "type": "string"
              }
            },
            "required": [
              "chunkId",
              "text",
              "startOffset",
              "endOffset"
            ],
            "type": "object"
          },
          "maxItems": 50,
          "type": "array"
        },
        "metadata": {
          "additionalProperties": false,
          "properties": {
            "author": {
              "anyOf": [
                {
                  "maxLength": 300,
                  "type": "string"
                },
                {
                  "type": "null"
                }
              ]
            },
            "contentType": {
              "anyOf": [
                {
                  "maxLength": 200,
                  "type": "string"
                },
                {
                  "type": "null"
                }
              ]
            },
            "description": {
              "anyOf": [
                {
                  "maxLength": 1000,
                  "type": "string"
                },
                {
                  "type": "null"
                }
              ]
            },
            "httpStatus": {
              "anyOf": [
                {
                  "maximum": 599,
                  "minimum": 100,
                  "type": "integer"
                },
                {
                  "type": "null"
                }
              ]
            },
            "imageUrl": {
              "anyOf": [
                {
                  "maxLength": 2048,
                  "type": "string"
                },
                {
                  "type": "null"
                }
              ]
            },
            "language": {
              "maxLength": 35,
              "minLength": 1,
              "type": "string"
            },
            "origin": {
              "maxLength": 255,
              "minLength": 1,
              "type": "string"
            },
            "pageType": {
              "anyOf": [
                {
                  "maxLength": 100,
                  "type": "string"
                },
                {
                  "type": "null"
                }
              ]
            },
            "publishedTime": {
              "anyOf": [
                {
                  "format": "date-time",
                  "pattern": "^(?:(?:\\d\\d[2468][048]|\\d\\d[13579][26]|\\d\\d0[48]|[02468][048]00|[13579][26]00)-02-29|\\d{4}-(?:(?:0[13578]|1[02])-(?:0[1-9]|[12]\\d|3[01])|(?:0[469]|11)-(?:0[1-9]|[12]\\d|30)|(?:02)-(?:0[1-9]|1\\d|2[0-8])))T(?:(?:[01]\\d|2[0-3]):[0-5]\\d(?::[0-5]\\d(?:\\.\\d+)?)?(?:Z|([+-](?:[01]\\d|2[0-3]):[0-5]\\d)))$",
                  "type": "string"
                },
                {
                  "type": "null"
                }
              ]
            },
            "siteName": {
              "anyOf": [
                {
                  "maxLength": 300,
                  "type": "string"
                },
                {
                  "type": "null"
                }
              ]
            },
            "title": {
              "maxLength": 500,
              "minLength": 1,
              "type": "string"
            },
            "updatedTime": {
              "anyOf": [
                {
                  "format": "date-time",
                  "pattern": "^(?:(?:\\d\\d[2468][048]|\\d\\d[13579][26]|\\d\\d0[48]|[02468][048]00|[13579][26]00)-02-29|\\d{4}-(?:(?:0[13578]|1[02])-(?:0[1-9]|[12]\\d|3[01])|(?:0[469]|11)-(?:0[1-9]|[12]\\d|30)|(?:02)-(?:0[1-9]|1\\d|2[0-8])))T(?:(?:[01]\\d|2[0-3]):[0-5]\\d(?::[0-5]\\d(?:\\.\\d+)?)?(?:Z|([+-](?:[01]\\d|2[0-3]):[0-5]\\d)))$",
                  "type": "string"
                },
                {
                  "type": "null"
                }
              ]
            },
            "url": {
              "maxLength": 2048,
              "type": "string"
            }
          },
          "required": [
            "title",
            "url",
            "origin",
            "language",
            "description",
            "author",
            "publishedTime",
            "updatedTime",
            "siteName",
            "pageType",
            "imageUrl",
            "httpStatus",
            "contentType"
          ],
          "type": "object"
        },
        "timing": {
          "additionalProperties": false,
          "properties": {
            "extractionMs": {
              "minimum": 0,
              "type": "number"
            },
            "navigationMs": {
              "minimum": 0,
              "type": "number"
            },
            "totalMs": {
              "minimum": 0,
              "type": "number"
            }
          },
          "required": [
            "navigationMs",
            "extractionMs",
            "totalMs"
          ],
          "type": "object"
        },
        "truncations": {
          "items": {
            "additionalProperties": false,
            "properties": {
              "atChunkId": {
                "maxLength": 64,
                "type": "string"
              },
              "atOffset": {
                "maximum": 9007199254740991,
                "minimum": 0,
                "type": "integer"
              },
              "reason": {
                "maxLength": 200,
                "minLength": 1,
                "type": "string"
              },
              "removedBlockCount": {
                "maximum": 9007199254740991,
                "minimum": 0,
                "type": "integer"
              },
              "removedChars": {
                "maximum": 9007199254740991,
                "minimum": 0,
                "type": "integer"
              }
            },
            "required": [
              "reason",
              "removedBlockCount",
              "removedChars"
            ],
            "type": "object"
          },
          "maxItems": 50,
          "type": "array"
        },
        "untrusted": {
          "const": true,
          "type": "boolean"
        },
        "warnings": {
          "items": {
            "additionalProperties": false,
            "properties": {
              "blockId": {
                "maxLength": 64,
                "type": "string"
              },
              "chunkId": {
                "maxLength": 64,
                "type": "string"
              },
              "code": {
                "enum": [
                  "hidden_content_stripped",
                  "credential_like_content",
                  "prompt_injection_suspected",
                  "document_truncated",
                  "chunk_truncated",
                  "chunk_limit_reached",
                  "no_semantic_container",
                  "affordance_limit_reached",
                  "accessibility_tree_unavailable",
                  "accessibility_node_limit_reached"
                ],
                "type": "string"
              },
              "message": {
                "maxLength": 500,
                "minLength": 1,
                "type": "string"
              },
              "offset": {
                "maximum": 9007199254740991,
                "minimum": 0,
                "type": "integer"
              }
            },
            "required": [
              "code",
              "message"
            ],
            "type": "object"
          },
          "maxItems": 100,
          "type": "array"
        }
      },
      "required": [
        "metadata",
        "accessibility",
        "chunks",
        "warnings",
        "truncations",
        "timing",
        "untrusted"
      ],
      "type": "object"
    },
    "sensitivity": {
      "additionalProperties": false,
      "properties": {
        "confirmationRequired": {
          "type": "boolean"
        },
        "reasons": {
          "items": {
            "enum": [
              "payment",
              "account_change",
              "irreversible_submission",
              "other"
            ],
            "type": "string"
          },
          "maxItems": 8,
          "type": "array"
        },
        "sensitive": {
          "type": "boolean"
        }
      },
      "required": [
        "sensitive",
        "confirmationRequired"
      ],
      "type": "object"
    },
    "status": {
      "const": "success",
      "type": "string"
    },
    "toolCallId": {
      "maxLength": 128,
      "minLength": 1,
      "pattern": "^[A-Za-z0-9][A-Za-z0-9_-]*$",
      "type": "string"
    }
  },
  "required": [
    "contractVersion",
    "correlation",
    "toolCallId",
    "status",
    "payload",
    "sensitivity"
  ],
  "type": "object"
}
