{
  "contractVersion": 1,
  "correlation": {
    "requestId": "req-0001",
    "userId": "user-0001",
    "sessionId": "sess-0001",
    "taskId": "task-0001"
  },
  "toolCallId": "call-0001",
  "status": "success",
  "payload": {
    "metadata": {
      "title": "What is an AI-native browser?",
      "url": "https://example.com/articles/ai-native-browsers",
      "language": "en",
      "description": "An overview of AI-native browsing.",
      "publishedTime": "2026-08-01T09:00:00Z",
      "httpStatus": 200,
      "contentType": "text/html; charset=utf-8",
      "origin": "https://example.com",
      "author": "Example Newsroom",
      "updatedTime": "2026-08-02T11:30:00Z",
      "siteName": "Example Publications",
      "pageType": "article",
      "imageUrl": "https://example.com/images/ai-native-browsers.png"
    },
    "accessibility": [
      {
        "nodeId": "ax-1",
        "parentId": null,
        "role": "heading",
        "name": "What is an AI-native browser?",
        "description": null,
        "value": null,
        "states": {
          "level": "1"
        },
        "domTag": "h1",
        "correlated": true
      },
      {
        "nodeId": "ax-2",
        "parentId": "ax-1",
        "role": "link",
        "name": "Read the full overview",
        "description": "Opens the long-form overview",
        "value": null,
        "states": {
          "disabled": false
        },
        "domTag": "a",
        "correlated": true
      }
    ],
    "chunks": [
      {
        "chunkId": "chunk-0",
        "text": "An AI-native browser lets a model drive real navigation.",
        "startOffset": 0,
        "endOffset": 58
      }
    ],
    "warnings": [],
    "truncations": [],
    "timing": {
      "navigationMs": 420.5,
      "extractionMs": 12.25,
      "totalMs": 432.75
    },
    "untrusted": true
  },
  "evidence": [
    {
      "sourceUrl": "https://example.com/articles/ai-native-browsers",
      "title": "What is an AI-native browser?",
      "snippet": "An AI-native browser lets a model drive real navigation.",
      "retrievedAt": "2026-08-22T12:00:00Z"
    }
  ],
  "sensitivity": {
    "sensitive": false,
    "confirmationRequired": false
  }
}
